{
  "schema_version": "decision-quality-human-disposition.v1",
  "disposition_id": "cyclone-gabrielle-t1-decision-quality-disposition-v2",
  "record_version": 2,
  "supersedes_record_digest": "01912186c48676886d0f7a18775dfe160002fae56f416258fadfe4480ac963bf",
  "created_on_sydney_date": "2026-08-24",
  "source_corpus": {
    "schema_version": "decision-quality-five-review-corpus-summary.v1",
    "record_digest": "f867838420302ab6bad12eb443f9969ddde228231aa4fa0ab924557cc55635c0",
    "reviewer_count": 5,
    "review_record_count": 150
  },
  "package_evidence": {
    "review_id": "91753061d940f8fa9be70d81",
    "package_digest": "b7e925e02d3118c888246b78cec248d1237c63d303284e35b461f7aa5b5a03a5",
    "scenario_id": "new-zealand-cyclone-gabrielle-roads-2023-v1",
    "cutoff_id": "T1_COROMANDEL_HIGHWAY_CLOSURES_CONFIRMED",
    "cutoff_at": "2023-02-13T10:40:00+13:00",
    "baseline_preference_count": 2,
    "challenger_preference_count": 3,
    "preference_consensus_pct": 60.0,
    "minimum_preference_consensus_pct": 66.67,
    "score_delta": 17.0,
    "raw_review_result": "REVIEWERS_DO_NOT_AGREE",
    "favored_variant_id": null
  },
  "disposition": {
    "status": "RESOLVED_HUMAN_ADJUDICATION",
    "resolution": "RETAIN_INCONCLUSIVE",
    "rationale": "Five reviewers split 3:2, so 60% consensus is below the frozen 66.67% gate; the 17-point score delta cannot replace the consensus requirement.",
    "decided_by_named_study_owner": true,
    "decided_on_sydney_date": "2026-08-24"
  },
  "privacy": {
    "study_owner_identity_retained": false,
    "reviewer_identifiers_retained": false,
    "credentials_retained": false,
    "answer_content_retained": false,
    "notes_retained": false
  },
  "governance": {
    "original_reviews_immutable": true,
    "disposition_is_not_an_additional_review": true,
    "raw_review_result_remains_authoritative": true,
    "no_winner_converted_to_winner": true,
    "separate_disposition_per_package": true
  },
  "claim_boundary": {
    "supports": ["HUMAN_RETAIN_INCONCLUSIVE_DISPOSITION"],
    "does_not_support": [
      "REVIEW_RESULT_OVERRIDE",
      "BUSINESS_OUTCOME_EFFECT",
      "REAL_LOGISTICS_PERFORMANCE",
      "A303_REACTIVATION",
      "MODEL_PROMOTION",
      "PRODUCTION_READINESS",
      "OPERATIONAL_AUTHORITY"
    ]
  },
  "authority": {
    "profile": "LOCAL_EVALUATION_GOVERNANCE_ONLY",
    "aws_write_allowed": false,
    "review_mutation_allowed": false,
    "public_publication_allowed": false,
    "action_authority": "NONE",
    "policy_activation_allowed": false,
    "model_promotion_allowed": false,
    "production_effect": false,
    "a303_reactivation_allowed": false
  },
  "operational_mutations": [],
  "record_digest": "eb45c05497ed9d06d0f9542ff9f96297099832af54972ac30b77c8a18cb99930"
}
